{
  "$schema": "https://json-schema.org/draft/2020-12/schema",
  "$id": "https://overlord.local/schemas/strategy-dsl/strategy_dry_run_case_file_summary.schema.json",
  "title": "Overlord StrategyDryRunCaseFileSummary",
  "type": "object",
  "required": [
    "strategy_dry_run_case_file_summary_id",
    "schema_version",
    "generated_at",
    "paper_only",
    "live_execution_allowed",
    "order_placement_allowed",
    "strategy_dry_run_evidence_bundle_id",
    "strategy_dry_run_readiness_checkpoint_id",
    "strategy_dry_run_plan_id",
    "strategy_dry_run_plan_evidence_summary_id",
    "strategy_dry_run_noop_summary_id",
    "replay_mode",
    "run_mode",
    "total_evidence_artifacts",
    "total_trace_records",
    "total_steps_observed",
    "readiness_status",
    "consistency_status",
    "status",
    "reason"
  ],
  "additionalProperties": false,
  "properties": {
    "strategy_dry_run_case_file_summary_id": { "type": "string", "pattern": "^sdrcfs_" },
    "schema_version": { "const": "strategy_dry_run_case_file_summary.v1" },
    "generated_at": { "type": "string", "format": "date-time" },
    "paper_only": { "const": true },
    "live_execution_allowed": { "const": false },
    "order_placement_allowed": { "const": false },
    "strategy_dry_run_evidence_bundle_id": { "type": "string", "pattern": "^sdreb_" },
    "strategy_dry_run_readiness_checkpoint_id": { "type": "string", "pattern": "^sdrpc_" },
    "strategy_dry_run_plan_id": { "type": "string", "pattern": "^sdrp_" },
    "strategy_dry_run_plan_evidence_summary_id": { "type": "string", "pattern": "^sdrpes_" },
    "strategy_dry_run_noop_summary_id": { "type": "string", "pattern": "^sdrns_" },
    "replay_mode": { "enum": ["offline_fixture_replay"] },
    "run_mode": { "enum": ["validation_only", "dry_run_planned"] },
    "total_evidence_artifacts": { "type": "integer", "minimum": 0 },
    "total_trace_records": { "type": "integer", "minimum": 0 },
    "total_steps_observed": { "type": "integer", "minimum": 0 },
    "readiness_status": { "enum": ["dry_run_ready", "dry_run_not_ready", "dry_run_readiness_unknown"] },
    "consistency_status": { "enum": ["consistency_passed", "consistency_failed", "consistency_not_applicable"] },
    "status": { "enum": ["dry_run_case_file_summary_ready", "dry_run_case_file_summary_rejected"] },
    "reason": { "type": "string" }
  }
}
